02/01/2006,"Next Generation Adelaide International, Adélaïde",Int' Series,394 000 $,Dur (ext.)
02/01/2006,"Chennai Open, Chennai",Int' Series,355 000 $,Dur (ext.)
02/01/2006,"Qatar ExxonMobil Open, Doha",Int' Series,975 000 $,Dur (ext.)
09/01/2006,"Heineken Open, Auckland",Int' Series,405 000 $,Dur (ext.)
09/01/2006,"Medibank International, Sydney",Int' Series,394 000 $,Dur (ext.)
16/01/2006,"Australian Open, Melbourne",G. Chelem,6 784 589 $,Dur (ext.)
30/01/2006,"Delray Beach International Tennis Championships, Delray Beach",Int' Series,355 000 $,Dur (ext.)
30/01/2006,"Movistar Open, Viña del Mar",Int' Series,355 000 $,Terre (ext.)
30/01/2006,"PBZ Zagreb Indoors, Zagreb",Int' Series,355 000 $,Moquette (int.)
13/02/2006,"Copa Telmex, Buenos Aires",Int' Series,400 000 $,Terre (ext.)
13/02/2006,"Open 13, Marseille",Int' Series,575 000 $,Dur (int.)
13/02/2006,"SAP Open, San José",Int' Series,355 000 $,Dur (int.)
20/02/2006,"Regions Morgan Keegan Championships, Memphis",Series Gold,665 000 $,Dur (int.)
20/02/2006,"ABN AMRO World Tennis Tournament, Rotterdam",Series Gold,900 000 $,Dur (int.)
20/02/2006,"Brasil Open, Costa do Sauípe",Int' Series,355 000 $,Terre (ext.)
27/02/2006,"Abierto Mexicano Telcel, Acapulco",Series Gold,665 000 $,Terre (ext.)
27/02/2006,"The Dubai Tennis Championships, Dubaï",Series Gold,975 000 $,Dur (ext.)
27/02/2006,"Tennis Channel Open, Las Vegas",Int' Series,355 000 $,Dur (ext.)
06/03/2006,"Pacific Life Open, Indian Wells",Masters Series,2 919 600 $,Dur (ext.)
20/03/2006,"NASDAQ-100 Open, Miami",Masters Series,3 200 000 $,Dur (ext.)
10/04/2006,"US Men's Clay Court Championship, Houston",Int' Series,355 000 $,Terre (ext.)
10/04/2006,"Open de Tenis Comunidad Valenciana, Valence",Int' Series,375 000 $,Terre (ext.)
17/04/2006,"Masters Series Monte-Carlo presented by Rolex, Monte-Carlo",Masters Series,2 200 000 $,Terre (ext.)
24/04/2006,"Open Seat, Barcelone",Series Gold,900 000 $,Terre (ext.)
24/04/2006,"Grand-Prix Hassan II, Casablanca",Int' Series,355 000 $,Terre (ext.)
01/05/2006,"Estoril Open, Estoril",Int' Series,600 000 $,Terre (ext.)
01/05/2006,"BMW Open by FWU AG, Munich",Int' Series,355 000 $,Terre (ext.)
08/05/2006,"Internazionali d'Italia, Rome",Masters Series,2 200 000 $,Terre (ext.)
15/05/2006,"Masters Series Hamburg presented by EON Hanse, Hambourg",Masters Series,2 200 000 $,Terre (ext.)
22/05/2006,"Hypo Group Tennis International, Pörtschach",Int' Series,355 000 $,Terre (ext.)
29/05/2006,"Roland-Garros, Paris",G. Chelem,8 543 691 $,Terre (ext.)
12/06/2006,"Gerry Weber Open, Halle (Westf.)",Int' Series,775 000 $,Gazon (ext.)
12/06/2006,"The Stella Artois Championships, Londres",Int' Series,775 000 $,Gazon (ext.)
19/06/2006,"Ordina Open, Bois-le-Duc",Int' Series,355 000 $,Gazon (ext.)
19/06/2006,"red letter DAYS Open, Nottingham",Int' Series,355 000 $,Gazon (ext.)
26/06/2006,"The Championships, Wimbledon",G. Chelem,8 847 338 $,Gazon (ext.)
10/07/2006,"Synsam Swedish Open, Båstad",Int' Series,355 000 $,Terre (ext.)
10/07/2006,"Allianz Suisse Open, Gstaad",Int' Series,470 000 $,Terre (ext.)
10/07/2006,"Campbell’s Hall of Fame Tennis Championships, Newport",Int' Series,355 000 $,Gazon (ext.)
17/07/2006,"Dutch Open Tennis, Amersfoort",Int' Series,355 000 $,Terre (ext.)
17/07/2006,"RCA Championships, Indianapolis",Int' Series,575 000 $,Dur (ext.)
17/07/2006,"Mercedes Cup, Stuttgart",Series Gold,665 000 $,Terre (ext.)
24/07/2006,"Generali Open, Kitzbühel",Series Gold,735 000 $,Terre (ext.)
24/07/2006,"Countrywide Classic, Los Angeles",Int' Series,475 000 $,Dur (ext.)
24/07/2006,"Studena Croatia Open, Umag",Int' Series,375 000 $,Terre (ext.)
31/07/2006,"Orange Prokom Open, Sopot",Int' Series,475 000 $,Terre (ext.)
31/07/2006,"Legg Mason Tennis Classic, Washington",Int' Series,575 000 $,Dur (ext.)
07/08/2006,"Rogers Cup, Toronto",Masters Series,2 200 000 $,Dur (ext.)
14/08/2006,"Western & Southern Financial Group Masters, Cincinnati",Masters Series,2 200 000 $,Dur (ext.)
21/08/2006,"Pilot Pen Tennis by Michelob Ultra, New Haven",Int' Series,650 000 $,Dur (ext.)
28/08/2006,"US Open, Flushing Meadows",G. Chelem,8 332 000 $,Dur (ext.)
11/09/2006,"China Open, Pékin",Int' Series,475 000 $,Dur (ext.)
11/09/2006,"BCR Open Romania, Bucarest",Int' Series,355 000 $,Terre (ext.)
25/09/2006,"Thailand Open, Bangkok",Int' Series,525 000 $,Dur (int.)
25/09/2006,"Kingfisher Airlines Tennis Open, Bombay",Int' Series,355 000 $,Dur (ext.)
25/09/2006,"Campionati Internazionali di Sicilia, Palerme",Int' Series,355 000 $,Terre (ext.)
02/10/2006,"Open de Moselle, Metz",Int' Series,355 000 $,Dur (int.)
02/10/2006,"AIG Japan Open Tennis Championships, Tokyo",Series Gold,665 000 $,Dur (ext.)
09/10/2006,"If Stockholm Open, Stockholm",Int' Series,775 000 $,Dur (int.)
09/10/2006,"BA-CA Tennis Trophy, Vienne",Series Gold,665 000 $,Dur (int.)
09/10/2006,"Kremlin Cup, Moscou",Int' Series,975 000 $,Moquette (int.)
16/10/2006,"Mutua Madrileña Masters Madrid, Madrid",Masters Series,2 200 000 $,Dur (int.)
23/10/2006,"Davidoff Swiss Indoors Basel, Bâle",Int' Series,975 000 $,Moquette (int.)
23/10/2006,"Grand Prix de tennis de Lyon, Lyon",Int' Series,775 000 $,Moquette (int.)
23/10/2006,"St. Petersburg Open, Saint-Pétersbourg",Int' Series,975 000 $,Moquette (int.)
30/10/2006,"BNP Paribas Masters, Paris",Masters Series,2 200 000 $,Moquette (int.)
13/11/2006,"Tennis Masters Cup, Shanghai",Masters,3 700 000 $,Dur (int.)